{
  "$schema": "protocol",
  "name": "Alpha Homora",
  "protocolVersion": ["1"],
  "description": "Alpha Homora is the first leveraged yield farming product in DeFi and first product by Alpha Finance Lab. Users can lever their positions and boost their returns by borrowing collateral supplied by Alpha Homora lenders.",
  "localization": {
    "en": {
      "name": "Alpha Homora",
      "description": "Alpha Homora is the first leveraged yield farming product in DeFi and first product by Alpha Finance Lab. Users can lever their positions and boost their returns by borrowing collateral supplied by Alpha Homora lenders."
    },
    "fr": {
      "name": "Alpha Homora",
      "description": "Alpha Homora est le premier produit de yield farming à effet de levier dans la DeFi et le premier produit d'Alpha Finance Lab. Les utilisateurs peuvent tirer parti de leurs positions et augmenter leurs rendements en empruntant des garanties provenant des prêteurs sur Alpha Homora."
    },
    "es": {
      "name": "Alpha Homora",
      "description": "Alpha Homora es el primer producto de agricultura de rendimiento apalancado en DeFi y el primer producto de Alpha Finance Lab. Los usuarios pueden apalancar sus posiciones y aumentar sus rendimientos tomando prestadas garantías proporcionadas por los prestamistas de Alpha Homora."
    },
    "de": {
      "name": "Alpha Homora",
      "description": "Alpha Homora ist das erste gehebelte Yield Farming Produkt in DeFi und das erste Produkt von Alpha Finance Lab. Die Nutzer können ihre Positionen hebeln und ihre Renditen steigern, indem sie die von den Alpha Homora Kreditgebern bereitgestellten Sicherheiten ausleihen."
    },
    "pt": {
      "name": "Alpha Homora",
      "description": "Alpha Homora é o primeiro produto de agricultura de rendimento alavancada em DeFi, e o primeiro produto de Alpha Finance Lab. Usuários podem alavancar suas posições e aumentar seus retornos ao tomar emprestado garantias disponibilizadas pelos usuários fornecedores em Alpha Homora."
    },
    "el": {
      "name": "Alpha Homora",
      "description": "Alpha Homora is the first leveraged yield farming product in DeFi and first product by Alpha Finance Lab. Users can lever their positions and boost their returns by borrowing collateral supplied by Alpha Homora lenders."
    },
    "tr": {
      "name": "Alpha Homora",
      "description": "Alpha Homora, DeFi'deki ilk kaldıraçlı verim çiftçiliği ürünü ve Alpha Finance Lab'in ilk ürünüdür. Kullanıcılar, Alpha Homora kredi sağlayıcıları tarafından sağlanan teminatları ödünç alarak pozisyonlarını kaldırabilir ve getirilerini artırabilir."
    },
    "vi": {
      "name": "Alpha Homora",
      "description": "Alpha Homora is the first leveraged yield farming product in DeFi and first product by Alpha Finance Lab. Users can lever their positions and boost their returns by borrowing collateral supplied by Alpha Homora lenders."
    },
    "zh": {
      "name": "Alpha Homora",
      "description": "Alpha Homora is the first leveraged yield farming product in DeFi and first product by Alpha Finance Lab. Users can lever their positions and boost their returns by borrowing collateral supplied by Alpha Homora lenders."
    },
    "hi": {
      "name": "Alpha Homora",
      "description": "Alpha Homora DeFi में पहला लीवरेज्ड यील्ड फार्मिंग उत्पाद है और Alpha Finance Lab का पहला उत्पाद है। उपयोगकर्ता Alpha Homora उधारदाताओं द्वारा आपूर्ति की गई कोलेटरल उधार लेकर अपनी स्थिति का लाभ उठा सकते हैं और अपने रिटर्न को बढ़ा सकते हैं।"
    },
    "ja": {
      "name": "Alpha Homora",
      "description": "Alpha HomoraはDeFiで初めてのレバレッジイールドファームプロダクトであり、Alpha Finance Labの初めてのプロダクトです。ユーザーはAlpha Homoraの貸し手が供給する担保を借りることで自分のポジションにレバレッジをかけ、リターンを高めることができます。"
    },
    "id": {
      "name": "Alpha Homora",
      "description": "Alpha Homora is the first leveraged yield farming product in DeFi and first product by Alpha Finance Lab. Users can lever their positions and boost their returns by borrowing collateral supplied by Alpha Homora lenders."
    },
    "ru": {
      "name": "Alpha Homora",
      "description": "Alpha Homora is the first leveraged yield farming product in DeFi and first product by Alpha Finance Lab. Users can lever their positions and boost their returns by borrowing collateral supplied by Alpha Homora lenders."
    }
  }
}
