{
  "$schema": "protocol",
  "name": "Idle Finance",
  "protocolVersion": ["1"],
  "description": "Idle Finance is a decentralized rebalancing protocol. It helps users to automatically and algorithmically manage their digital asset allocation among different third-party DeFi protocols. Users can choose to maximize interest rate returns through MaxYield strategy or minimize their risk exposure through RiskAdjusted allocation strategy.",
  "localization": {
    "en": {
      "name": "Idle Finance",
      "description": "Idle Finance is a decentralized rebalancing protocol. It helps users to automatically and algorithmically manage their digital asset allocation among different third-party DeFi protocols. Users can choose to maximize interest rate returns through MaxYield strategy or minimize their risk exposure through RiskAdjusted allocation strategy."
    },
    "fr": {
      "name": "Idle Finance",
      "description": "Idle Finance est un protocole décentralisé de rééquilibrage. Il aide les utilisateurs à gérer automatiquement et de manière algorithmique leur allocation d'actifs numériques entre différents protocoles tiers dans la DeFi. Les utilisateurs peuvent choisir de maximiser leurs rendements des taux d'intérêt grâce à la stratégie MaxYield ou de minimiser leur exposition au risque grâce à la stratégie d'allocation RiskAdjusted."
    },
    "es": {
      "name": "Idle Finance",
      "description": "Idle Finance es un protocolo de rebalanceo descentralizado. Ayuda a los usuarios a administrar de forma automática y algorítmica su asignación de activos digitales entre diferentes protocolos DeFi de terceros. Los usuarios pueden optar por maximizar los rendimientos de las tasas de interés a través de la estrategia MaxYield o minimizar su exposición al riesgo a través de la estrategia de asignación RiskAdjusted."
    },
    "de": {
      "name": "Idle Finance",
      "description": "Idle Finance ist ein dezentrales Rebalancing-Protokoll. Es hilft den Nutzern bei der automatischen und algorithmischen Verwaltung ihrer digitalen Vermögensallokation zwischen verschiedenen DeFi-Protokollen von Drittanbietern. Die Nutzer können wählen, ob sie die Zinserträge durch die MaxYield-Strategie maximieren oder ihr Risiko durch die RiskAdjusted-Allokationsstrategie minimieren wollen."
    },
    "pt": {
      "name": "Idle Finance",
      "description": "Idle Finance é um protocolo de rebalanceamento descentralizado. Ele ajuda usuários a automaticamente e algoritmicamente gerenciar sua alocação de ativos digitais entre diferentes protocolos DeFi. Usuários podem escolher maximizar os retornos em taxas de juros através da estratégia MaxYield ou minimizar sua exposição ao risco através da alocação na estratégia RiskAdjusted."
    },
    "el": {
      "name": "Idle Finance",
      "description": "Idle Finance is a decentralized rebalancing protocol. It helps users to automatically and algorithmically manage their digital asset allocation among different third-party DeFi protocols. Users can choose to maximize interest rate returns through MaxYield strategy or minimize their risk exposure through RiskAdjusted allocation strategy."
    },
    "tr": {
      "name": "Idle Finance",
      "description": "Idle Finance, merkezi olmayan bir yeniden dengeleme protokolüdür. Kullanıcıların, farklı üçüncü taraf DeFi protokolleri arasında dijital varlık tahsislerini otomatik ve algoritmik olarak yönetmelerine yardımcı olur. Kullanıcılar, MaxYield stratejisi aracılığıyla faiz oranı getirilerini en üst düzeye çıkarmayı veya RiskAdjusted tahsis stratejisi aracılığıyla risk maruziyetlerini en aza indirmeyi seçebilir."
    },
    "vi": {
      "name": "Idle Finance",
      "description": "Idle Finance is a decentralized rebalancing protocol. It helps users to automatically and algorithmically manage their digital asset allocation among different third-party DeFi protocols. Users can choose to maximize interest rate returns through MaxYield strategy or minimize their risk exposure through RiskAdjusted allocation strategy."
    },
    "zh": {
      "name": "Idle Finance",
      "description": "Idle Finance is a decentralized rebalancing protocol. It helps users to automatically and algorithmically manage their digital asset allocation among different third-party DeFi protocols. Users can choose to maximize interest rate returns through MaxYield strategy or minimize their risk exposure through RiskAdjusted allocation strategy."
    },
    "hi": {
      "name": "Idle Finance",
      "description": "Idle Finance एक विकेन्द्रीकृत पुनर्संतुलन प्रोटोकॉल है। यह उपयोगकर्ताओं को विभिन्न तृतीय-पक्ष DeFi प्रोटोकॉल के बीच अपने डिजिटल परिसंपत्ति आवंटन को स्वचालित रूप से और एल्गोरिदमिक रूप से प्रबंधित करने में मदद करता है। उपयोगकर्ता मैक्स यील्ड रणनीति के माध्यम से ब्याज दर रिटर्न को अधिकतम करने या जोखिम समायोजित आवंटन रणनीति के माध्यम से अपने जोखिम जोखिम को कम करने का विकल्प चुन सकते हैं।"
    },
    "ja": {
      "name": "Idle Finance",
      "description": "Idle Financeは分散型リバランスプロトコルです。ユーザーが異なるサードパーティのDeFiプロトコルの間でデジタル資産の配分を自動的かつアルゴリズム的に管理するのを助けます。ユーザーはMaxYield戦略によって金利リターンを最大化するか、RiskAdjusted配分戦略によってリスクエクスポージャを最小化するかを選択することができます。"
    },
    "id": {
      "name": "Idle Finance",
      "description": "Idle Finance is a decentralized rebalancing protocol. It helps users to automatically and algorithmically manage their digital asset allocation among different third-party DeFi protocols. Users can choose to maximize interest rate returns through MaxYield strategy or minimize their risk exposure through RiskAdjusted allocation strategy."
    },
    "ru": {
      "name": "Idle Finance",
      "description": "Idle Finance is a decentralized rebalancing protocol. It helps users to automatically and algorithmically manage their digital asset allocation among different third-party DeFi protocols. Users can choose to maximize interest rate returns through MaxYield strategy or minimize their risk exposure through RiskAdjusted allocation strategy."
    }
  }
}
