{
  "$schema": "protocol",
  "name": "Tarot",
  "protocolVersion": ["1"],
  "description": "Tarot is a decentralized lending protocol on the Fantom network. It's a decentralized lending protocol where users can lend or borrow in isolated pools which enables borrowers to leverage their LP tokens for leveraged yield farming.",
  "localization": {
    "en": {
      "name": "Tarot",
      "description": "Tarot is a decentralized lending protocol on the Fantom network. It's a decentralized lending protocol where users can lend or borrow in isolated pools which enables borrowers to leverage their LP tokens for leveraged yield farming."
    },
    "fr": {
      "name": "Tarot",
      "description": "Tarot est un protocole de prêt décentralisé sur le réseau Fantom. Il s'agit d'un protocole de prêt décentralisé sur lequel les utilisateurs peuvent prêter ou emprunter grâce à des pools isolées, ce qui permet aux emprunteurs de tirer parti de leurs jetons LP pour réaliser du yield farming avec effet de levier."
    },
    "es": {
      "name": "Tarot",
      "description": "Tarot es un protocolo descentralizado de préstamos en la red Fantom. Es un protocolo de préstamos en el que los usuarios pueden prestar o pedir prestado en pools aislados que les permite aprovechar sus tokens LP para apalancar su rendimiento."
    },
    "de": {
      "name": "Tarot",
      "description": "Tarot ist ein dezentrales Kreditprotokoll im Fantom-Netzwerk. Es ist ein dezentralisiertes Kreditprotokoll, bei dem Nutzer in isolierten Pools leihen oder verleihen können, was es Kreditnehmern ermöglicht, ihre LP-Token für Leverage Yield Farming zu nutzen."
    },
    "pt": {
      "name": "Tarot",
      "description": "Tarot é um protocolo de empréstimo descentralizado na rede Fantom. É um protocolo descentralizado de empréstimo onde os usuários podem emprestar ou tomar emprestado em pools isolados, o que permite que os tomadores de empréstimo alavanquem seus tokens LP para realizar farming alavancada de rendimentos."
    },
    "el": {
      "name": "Tarot",
      "description": "Tarot is a decentralized lending protocol on the Fantom network. It's a decentralized lending protocol where users can lend or borrow in isolated pools which enables borrowers to leverage their LP tokens for leveraged yield farming."
    },
    "tr": {
      "name": "Tarot",
      "description": "Tarot, Fantom ağındaki merkezi olmayan bir borç verme protokolüdür. Kullanıcıların izole havuzlarda ödünç verebildiği veya ödünç alabildiği ve borçluların kaldıraç verimi çiftçiliği için LP jetonlarından yararlanmalarını sağlayan merkezi olmayan bir borç verme protokolüdür."
    },
    "vi": {
      "name": "Tarot",
      "description": "Tarot is a decentralized lending protocol on the Fantom network. It's a decentralized lending protocol where users can lend or borrow in isolated pools which enables borrowers to leverage their LP tokens for leveraged yield farming."
    },
    "zh": {
      "name": "Tarot",
      "description": "Tarot 是个在 Fantom 网络上的去中心化借贷协议。其去中心化借贷协议让用户可以在独立的池中借出或借入资产，从而使得借款人能够应用他们的 LP 代币做杠杆挖矿。"
    },
    "hi": {
      "name": "Tarot",
      "description": "Tarot, Fantom नेटवर्क पर एक विकेन्द्रीकृत उधार प्रोटोकॉल है। यह एक विकेन्द्रीकृत उधार प्रोटोकॉल है जहां उपयोगकर्ता अलग-अलग पूल में उधार दे सकते हैं या उधार ले सकते हैं जो उधारकर्ताओं को लीवरेज उपज खेती के लिए अपने LP टोकन का लाभ उठाने में सक्षम बनाता है।"
    },
    "ja": {
      "name": "Tarot",
      "description": "TarotはFantomネットワーク上の分散型レンディングプロトコルです。分離されたプールでトークンの貸し借りができる分散型レンディングプロトコルであり、借り手はLPトークンを活用してレバレッジイールドファーミングを行うことができます。"
    },
    "id": {
      "name": "Tarot",
      "description": "Tarot is a decentralized lending protocol on the Fantom network. It's a decentralized lending protocol where users can lend or borrow in isolated pools which enables borrowers to leverage their LP tokens for leveraged yield farming."
    },
    "ru": {
      "name": "Tarot",
      "description": "Tarot is a decentralized lending protocol on the Fantom network. It's a decentralized lending protocol where users can lend or borrow in isolated pools which enables borrowers to leverage their LP tokens for leveraged yield farming."
    }
  }
}
