{
  "$schema": "protocol",
  "name": "Hop Exchange",
  "protocolVersion": ["1"],
  "description": "Hop Exchange is a scalable rollup-to-rollup general token bridge and Automated Market Maker. Users can have a say in protocol governance with its native HOP token.",
  "localization": {
    "en": {
      "name": "Hop Exchange",
      "description": "Hop Exchange is a scalable rollup-to-rollup general token bridge and Automated Market Maker. Users can have a say in protocol governance with its native HOP token."
    },
    "fr": {
      "name": "Hop Exchange",
      "description": "Hop Exchange is a scalable rollup-to-rollup general token bridge and Automated Market Maker. Users can have a say in protocol governance with its native HOP token."
    },
    "es": {
      "name": "Hop Exchange",
      "description": "Hop Exchange is a scalable rollup-to-rollup general token bridge and Automated Market Maker. Users can have a say in protocol governance with its native HOP token."
    },
    "de": {
      "name": "Hop Exchange",
      "description": "Hop Exchange is a scalable rollup-to-rollup general token bridge and Automated Market Maker. Users can have a say in protocol governance with its native HOP token."
    },
    "pt": {
      "name": "Hop Exchange",
      "description": "Hop Exchange is a scalable rollup-to-rollup general token bridge and Automated Market Maker. Users can have a say in protocol governance with its native HOP token."
    },
    "el": {
      "name": "Hop Exchange",
      "description": "Hop Exchange is a scalable rollup-to-rollup general token bridge and Automated Market Maker. Users can have a say in protocol governance with its native HOP token."
    },
    "tr": {
      "name": "Hop Exchange",
      "description": "Hop Exchange is a scalable rollup-to-rollup general token bridge and Automated Market Maker. Users can have a say in protocol governance with its native HOP token."
    },
    "vi": {
      "name": "Hop Exchange",
      "description": "Hop Exchange is a scalable rollup-to-rollup general token bridge and Automated Market Maker. Users can have a say in protocol governance with its native HOP token."
    },
    "zh": {
      "name": "Hop Exchange",
      "description": "Hop Exchange is a scalable rollup-to-rollup general token bridge and Automated Market Maker. Users can have a say in protocol governance with its native HOP token."
    },
    "hi": {
      "name": "Hop Exchange",
      "description": "Hop Exchange is a scalable rollup-to-rollup general token bridge and Automated Market Maker. Users can have a say in protocol governance with its native HOP token."
    },
    "ja": {
      "name": "Hop Exchange",
      "description": "Hop Exchange is a scalable rollup-to-rollup general token bridge and Automated Market Maker. Users can have a say in protocol governance with its native HOP token."
    },
    "id": {
      "name": "Hop Exchange",
      "description": "Hop Exchange is a scalable rollup-to-rollup general token bridge and Automated Market Maker. Users can have a say in protocol governance with its native HOP token."
    },
    "ru": {
      "name": "Hop Exchange",
      "description": "Hop Exchange is a scalable rollup-to-rollup general token bridge and Automated Market Maker. Users can have a say in protocol governance with its native HOP token."
    }
  }
}
