{
  "$schema": "protocol",
  "name": "Ester Finance",
  "protocolVersion": ["1"],
  "description": "Ester Finance is a yield aggregator. It helps users to earn interest where strategies optimize the returns.",
  "localization": {
    "en": {
      "name": "Ester Finance",
      "description": "Ester Finance is a yield aggregator. It helps users to earn interest where strategies optimize the returns."
    },
    "fr": {
      "name": "Ester Finance",
      "description": "Ester Finance est un agrégateur de rendement. Il aide les utilisateurs à générer des intérêts là où les stratégies sont les plus intéréssantes."
    },
    "es": {
      "name": "Ester Finance",
      "description": "Ester Finance es un agregador de rendimiento. Ayuda a los usuarios a ganar intereses donde la estrategia optimiza los rendimientos."
    },
    "de": {
      "name": "Ester Finance",
      "description": "Ester Finance ist ein Renditeaggregator. Es hilft den Nutzern, dort Zinsen zu verdienen, wo Strategien die Rendite optimieren."
    },
    "pt": {
      "name": "Ester Finance",
      "description": "Ester Finance é um agregador de rendimento. Ajuda os usuários a receber rendimentos enquanto as estratégias otimizam os retornos."
    },
    "el": {
      "name": "Ester Finance",
      "description": "Ester Finance is a yield aggregator. It helps users to earn interest where strategies optimize the returns."
    },
    "tr": {
      "name": "Ester Finance",
      "description": "Ester Finance bir getiri toplayıcıdır. Stratejilerin getirileri optimize ettiği durumlarda kullanıcıların faiz kazanmalarına yardımcı olur."
    },
    "vi": {
      "name": "Ester Finance",
      "description": "Ester Finance is a yield aggregator. It helps users to earn interest where strategies optimize the returns."
    },
    "zh": {
      "name": "Ester Finance",
      "description": "Ester Finance 是个收益聚合器。他们的策略旨在为用户赚取最优化的收益。"
    },
    "hi": {
      "name": "Ester Finance",
      "description": "Ester Finance एक यील्ड एग्रीगेटर है। यह उपयोगकर्ताओं को ब्याज अर्जित करने में मदद करता है जहां रणनीतियाँ रिटर्न का अनुकूलन करती हैं।"
    },
    "ja": {
      "name": "Ester Finance",
      "description": "Ester Financeはイールドアグリゲーターです。利回りを最適化するストラテジーにより、ユーザーが利息を得ることを支援します。"
    },
    "id": {
      "name": "Ester Finance",
      "description": "Ester Finance is a yield aggregator. It helps users to earn interest where strategies optimize the returns."
    },
    "ru": {
      "name": "Ester Finance",
      "description": "Ester Finance is a yield aggregator. It helps users to earn interest where strategies optimize the returns."
    }
  }
}
